{
 "characterId": 10059,
 "kind": "student",
 "devName": "CH0069",
 "names": {
  "ko": "미카",
  "ja": "ミカ"
 },
 "clientVersionId": "jp-1.73.0-e2baf70e",
 "sourceHashes": {
  "excelDb": "a5cfbbb9c7f00ccdd82a59e100febb7ed5eb107bc8ac93c6ed0dede14418416a",
  "excelZip": "f9e8e721c14486a1517b627799ea03122aaa39da4f024eda3da1da7c8347c97b",
  "bundles": [
   {
    "path": "BlueArchive_Data/StreamingAssets/AssetBundles/assets-_mx-characters-ch0069-_mxdependency-animationclips-2025-07-02_assets_all_1874348671.bundle",
    "sha256": "2575d3f43366f7b0cb7f6f7fe1ff3bae30fc2465b8408b96811b68c2176e0bd2"
   }
  ]
 },
 "clips": [
  {
   "name": "CH0069_Cafe_Idle",
   "bundlePath": "BlueArchive_Data/StreamingAssets/AssetBundles/assets-_mx-characters-ch0069-_mxdependency-animationclips-2025-07-02_assets_all_1874348671.bundle",
   "sourceFps": 30.0,
   "lengthSeconds": 4.0,
   "lengthLogicFrames": 120,
   "logicDurationFrames": null,
   "events": [
    {
     "frame": 0,
     "timeSeconds": 0.0,
     "layer": "anim_event",
     "name": "SetMouthTile",
     "kind": "other",
     "evidence": {
      "kind": "observation",
      "clipPath": "BlueArchive_Data/StreamingAssets/AssetBundles/assets-_mx-characters-ch0069-_mxdependency-animationclips-2025-07-02_assets_all_1874348671.bundle#AnimationClip[name=CH0069_Cafe_Idle;PathID=-5905037783361450905]"
     },
     "estimated": false,
     "note": "callback metadata; no damage/hit meaning assigned"
    }
   ]
  },
  {
   "name": "CH0069_Cafe_Reaction",
   "bundlePath": "BlueArchive_Data/StreamingAssets/AssetBundles/assets-_mx-characters-ch0069-_mxdependency-animationclips-2025-07-02_assets_all_1874348671.bundle",
   "sourceFps": 30.0,
   "lengthSeconds": 8.0,
   "lengthLogicFrames": 240,
   "logicDurationFrames": null,
   "events": [
    {
     "frame": 0,
     "timeSeconds": 0.0,
     "layer": "anim_event",
     "name": "SetMouthTile",
     "kind": "other",
     "evidence": {
      "kind": "observation",
      "clipPath": "BlueArchive_Data/StreamingAssets/AssetBundles/assets-_mx-characters-ch0069-_mxdependency-animationclips-2025-07-02_assets_all_1874348671.bundle#AnimationClip[name=CH0069_Cafe_Reaction;PathID=6817957784461517603]"
     },
     "estimated": false,
     "note": "callback metadata; no damage/hit meaning assigned"
    },
    {
     "frame": 6,
     "timeSeconds": 0.20000001788139343,
     "layer": "anim_event",
     "name": "SetMouthTile",
     "kind": "other",
     "evidence": {
      "kind": "observation",
      "clipPath": "BlueArchive_Data/StreamingAssets/AssetBundles/assets-_mx-characters-ch0069-_mxdependency-animationclips-2025-07-02_assets_all_1874348671.bundle#AnimationClip[name=CH0069_Cafe_Reaction;PathID=6817957784461517603]"
     },
     "estimated": false,
     "note": "callback metadata; no damage/hit meaning assigned"
    },
    {
     "frame": 9,
     "timeSeconds": 0.30000001192092896,
     "layer": "anim_event",
     "name": "SetMouthTile",
     "kind": "other",
     "evidence": {
      "kind": "observation",
      "clipPath": "BlueArchive_Data/StreamingAssets/AssetBundles/assets-_mx-characters-ch0069-_mxdependency-animationclips-2025-07-02_assets_all_1874348671.bundle#AnimationClip[name=CH0069_Cafe_Reaction;PathID=6817957784461517603]"
     },
     "estimated": false,
     "note": "callback metadata; no damage/hit meaning assigned"
    },
    {
     "frame": 30,
     "timeSeconds": 1.0,
     "layer": "anim_event",
     "name": "SetMouthTile",
     "kind": "other",
     "evidence": {
      "kind": "observation",
      "clipPath": "BlueArchive_Data/StreamingAssets/AssetBundles/assets-_mx-characters-ch0069-_mxdependency-animationclips-2025-07-02_assets_all_1874348671.bundle#AnimationClip[name=CH0069_Cafe_Reaction;PathID=6817957784461517603]"
     },
     "estimated": false,
     "note": "callback metadata; no damage/hit meaning assigned"
    },
    {
     "frame": 44,
     "timeSeconds": 1.4666666984558105,
     "layer": "anim_event",
     "name": "AniEvt_InstantiateFx",
     "kind": "vfx",
     "evidence": {
      "kind": "observation",
      "clipPath": "BlueArchive_Data/StreamingAssets/AssetBundles/assets-_mx-characters-ch0069-_mxdependency-animationclips-2025-07-02_assets_all_1874348671.bundle#AnimationClip[name=CH0069_Cafe_Reaction;PathID=6817957784461517603]"
     },
     "estimated": true,
     "note": "callback metadata; category inferred from callback name; effect/hit application unknown"
    },
    {
     "frame": 49,
     "timeSeconds": 1.633333444595337,
     "layer": "anim_event",
     "name": "SetMouthTile",
     "kind": "other",
     "evidence": {
      "kind": "observation",
      "clipPath": "BlueArchive_Data/StreamingAssets/AssetBundles/assets-_mx-characters-ch0069-_mxdependency-animationclips-2025-07-02_assets_all_1874348671.bundle#AnimationClip[name=CH0069_Cafe_Reaction;PathID=6817957784461517603]"
     },
     "estimated": false,
     "note": "callback metadata; no damage/hit meaning assigned"
    },
    {
     "frame": 99,
     "timeSeconds": 3.3000001907348633,
     "layer": "anim_event",
     "name": "SetMouthTile",
     "kind": "other",
     "evidence": {
      "kind": "observation",
      "clipPath": "BlueArchive_Data/StreamingAssets/AssetBundles/assets-_mx-characters-ch0069-_mxdependency-animationclips-2025-07-02_assets_all_1874348671.bundle#AnimationClip[name=CH0069_Cafe_Reaction;PathID=6817957784461517603]"
     },
     "estimated": false,
     "note": "callback metadata; no damage/hit meaning assigned"
    },
    {
     "frame": 132,
     "timeSeconds": 4.400000095367432,
     "layer": "anim_event",
     "name": "SetMouthTile",
     "kind": "other",
     "evidence": {
      "kind": "observation",
      "clipPath": "BlueArchive_Data/StreamingAssets/AssetBundles/assets-_mx-characters-ch0069-_mxdependency-animationclips-2025-07-02_assets_all_1874348671.bundle#AnimationClip[name=CH0069_Cafe_Reaction;PathID=6817957784461517603]"
     },
     "estimated": false,
     "note": "callback metadata; no damage/hit meaning assigned"
    },
    {
     "frame": 163,
     "timeSeconds": 5.433333396911621,
     "layer": "anim_event",
     "name": "SetMouthTile",
     "kind": "other",
     "evidence": {
      "kind": "observation",
      "clipPath": "BlueArchive_Data/StreamingAssets/AssetBundles/assets-_mx-characters-ch0069-_mxdependency-animationclips-2025-07-02_assets_all_1874348671.bundle#AnimationClip[name=CH0069_Cafe_Reaction;PathID=6817957784461517603]"
     },
     "estimated": false,
     "note": "callback metadata; no damage/hit meaning assigned"
    },
    {
     "frame": 164,
     "timeSeconds": 5.466667175292969,
     "layer": "anim_event",
     "name": "SetMouthTile",
     "kind": "other",
     "evidence": {
      "kind": "observation",
      "clipPath": "BlueArchive_Data/StreamingAssets/AssetBundles/assets-_mx-characters-ch0069-_mxdependency-animationclips-2025-07-02_assets_all_1874348671.bundle#AnimationClip[name=CH0069_Cafe_Reaction;PathID=6817957784461517603]"
     },
     "estimated": false,
     "note": "callback metadata; no damage/hit meaning assigned"
    },
    {
     "frame": 230,
     "timeSeconds": 7.6666669845581055,
     "layer": "anim_event",
     "name": "SetMouthTile",
     "kind": "other",
     "evidence": {
      "kind": "observation",
      "clipPath": "BlueArchive_Data/StreamingAssets/AssetBundles/assets-_mx-characters-ch0069-_mxdependency-animationclips-2025-07-02_assets_all_1874348671.bundle#AnimationClip[name=CH0069_Cafe_Reaction;PathID=6817957784461517603]"
     },
     "estimated": false,
     "note": "callback metadata; no damage/hit meaning assigned"
    }
   ]
  },
  {
   "name": "CH0069_Cafe_Walk",
   "bundlePath": "BlueArchive_Data/StreamingAssets/AssetBundles/assets-_mx-characters-ch0069-_mxdependency-animationclips-2025-07-02_assets_all_1874348671.bundle",
   "sourceFps": 30.0,
   "lengthSeconds": 1.3333333730697632,
   "lengthLogicFrames": 40,
   "logicDurationFrames": null,
   "events": []
  },
  {
   "name": "CH0069_Exs",
   "bundlePath": "BlueArchive_Data/StreamingAssets/AssetBundles/assets-_mx-characters-ch0069-_mxdependency-animationclips-2025-07-02_assets_all_1874348671.bundle",
   "sourceFps": 30.0,
   "lengthSeconds": 5.900000095367432,
   "lengthLogicFrames": 177,
   "logicDurationFrames": null,
   "events": [
    {
     "frame": 0,
     "timeSeconds": 0.0,
     "layer": "anim_event",
     "name": "SetMouthTile",
     "kind": "other",
     "evidence": {
      "kind": "observation",
      "clipPath": "BlueArchive_Data/StreamingAssets/AssetBundles/assets-_mx-characters-ch0069-_mxdependency-animationclips-2025-07-02_assets_all_1874348671.bundle#AnimationClip[name=CH0069_Exs;PathID=3749176414220937176]"
     },
     "estimated": false,
     "note": "callback metadata; no damage/hit meaning assigned"
    },
    {
     "frame": 13,
     "timeSeconds": 0.4333333671092987,
     "layer": "anim_event",
     "name": "SetMouthTile",
     "kind": "other",
     "evidence": {
      "kind": "observation",
      "clipPath": "BlueArchive_Data/StreamingAssets/AssetBundles/assets-_mx-characters-ch0069-_mxdependency-animationclips-2025-07-02_assets_all_1874348671.bundle#AnimationClip[name=CH0069_Exs;PathID=3749176414220937176]"
     },
     "estimated": false,
     "note": "callback metadata; no damage/hit meaning assigned"
    },
    {
     "frame": 103,
     "timeSeconds": 3.4333336353302,
     "layer": "anim_event",
     "name": "SetMouthTile",
     "kind": "other",
     "evidence": {
      "kind": "observation",
      "clipPath": "BlueArchive_Data/StreamingAssets/AssetBundles/assets-_mx-characters-ch0069-_mxdependency-animationclips-2025-07-02_assets_all_1874348671.bundle#AnimationClip[name=CH0069_Exs;PathID=3749176414220937176]"
     },
     "estimated": false,
     "note": "callback metadata; no damage/hit meaning assigned"
    },
    {
     "frame": 176,
     "timeSeconds": 5.866666793823242,
     "layer": "anim_event",
     "name": "SetMouthTile",
     "kind": "other",
     "evidence": {